<?xml version="1.0" encoding="UTF-8"?>
<xs:schema xmlns:xs="http://www.w3.org/2001/XMLSchema" elementFormDefault="qualified">
    <xs:element name="countries" type="countriesType"/>

    <xs:complexType name="countriesType">
        <xs:sequence>
            <xs:element name="country" type="countryType" minOccurs="0" maxOccurs="unbounded"/>
        </xs:sequence>
    </xs:complexType>

    <xs:complexType name="countryType">
        <xs:simpleContent>
            <xs:extension base="xs:string">
                <xs:attribute name="num" type="xs:positiveInteger"/>
            </xs:extension>
        </xs:simpleContent>
    </xs:complexType>
</xs:schema>
